{
  "schema_version": "readingpaper.seed_papers.v1",
  "created_by": "finalpaper",
  "created_at": "2026-05-26T00:00:00+00:00",
  "seed_papers": [
    {
      "seed_id": "seed-001",
      "source_file": "input/papers/example.pdf",
      "title": "Example Paper Title",
      "authors": ["Alice Smith", "Bob Li"],
      "year": 2024,
      "doi": "10.1234/example",
      "arxiv_id": "2401.12345",
      "abstract": "A seed abstract about retrieval and language models.",
      "keywords": ["retrieval", "language models"],
      "key_claims": ["The paper proposes a retrieval method."],
      "methods": ["retrieval augmented generation"],
      "datasets": ["ExampleSet"],
      "metadata_confidence": "high",
      "needs_review": false,
      "provenance": {"source": "finalpaper", "extracted_from": "input/papers/example.pdf"}
    }
  ]
}
